{
  "$schema": "./portfolio.schema.json",
  "works": [
    {
      "slug": "tresor-globus",
      "title": "Tresor Globus",
      "category": "Retail & Hospitality",
      "year": "2023",
      "client": "Tresor Berlin",
      "location": "Berlin, Germany",
      "description": "MESHACK redesigned the Globus floor at Tresor Berlin with a new spatial concept that redefines one of the club's most iconic spaces. A reworked layout, centrally positioned bar, and flexible room structure create a dynamic balance between dance floor and lounge areas, adaptable to different event formats. Combined with full-surface sound absorbers and the Lambda sound system, the redesign merges architecture, acoustics, and atmosphere into one cohesive club experience.",
      "heroImage": "https://framerusercontent.com/images/og-social-preview.webp?width=6201&height=4134",
      "galleryImages": [
        "https://framerusercontent.com/images/project-tresor-globus-2.webp?width=6201&height=4134",
        "https://framerusercontent.com/images/project-tresor-globus.webp?width=4134&height=6201",
        "https://framerusercontent.com/images/project-tresor-globus-8.webp?width=4134&height=6201",
        "https://framerusercontent.com/images/project-tresor-globus-9.webp?width=6201&height=4134"
      ]
    },
    {
      "slug": "dojo",
      "title": "Dojo",
      "category": "Workplace & New Work / Interior Design",
      "year": "2023",
      "client": "DOJO",
      "location": "Berlin, Germany",
      "description": "Where History Meets High Contrast. MESHACK reimagines DOJO's Kreuzberg headquarters—a former church transformed into a high-performance creative hub defined by sleek materials, acoustic precision, and an iconic domed centerpiece.",
      "heroImage": "https://framerusercontent.com/images/og-social-preview-3.webp?width=2000&height=1333",
      "galleryImages": [
        "https://framerusercontent.com/images/og-social-preview-3.webp?width=2000&height=1333"
      ]
    },
    {
      "slug": "reforma-x-people-people",
      "title": "Reforma X People People",
      "category": "Retail & Hospitality / Interior Design",
      "year": "2024",
      "client": "REFORMA",
      "location": "Cologne, Germany",
      "description": "Located in the heart of Cologne's Belgian Quarter, this dual-concept space by MESHACK blends urban energy with mindful movement. A harmonious interplay of raw concrete, warm timber, and refined lighting.",
      "heroImage": "https://framerusercontent.com/images/og-social-preview-2.jpg?width=1980&height=1320",
      "galleryImages": [
        "https://framerusercontent.com/images/og-social-preview-2.jpg?width=1980&height=1320"
      ]
    },
    {
      "slug": "ohm-club",
      "title": "Ohm Club",
      "category": "Retail & Hospitality",
      "year": "2019",
      "client": "OHM",
      "location": "Berlin, Germany",
      "description": "OHM, one of Berlin's most iconic electronic music clubs, was conceived, designed and built in collaboration with MESHACK. The space translates the energy of electronic music into a minimal, atmospheric environment focused on sound, rhythm and community.",
      "heroImage": "https://framerusercontent.com/images/og-social-preview.jpeg?width=7087&height=4725",
      "galleryImages": [
        "https://framerusercontent.com/images/project-tresor-globus.png?width=600&height=600"
      ]
    },
    {
      "slug": "lokal-vier",
      "title": "Lokal Vier",
      "category": "Retail & Hospitality",
      "year": "2021",
      "client": "LOKAL VIER",
      "location": "Hannover, Germany",
      "description": "For Lokal Vier in Hanover, MESHACK created a warm, contemporary restaurant concept designed as an all-day, 24/7 meeting place. The space combines a cozy, inviting atmosphere with a cool, modern aesthetic, encouraging guests to stay, connect, and return at any time of day.",
      "heroImage": "https://framerusercontent.com/images/og-social-preview-2.webp?width=5930&height=3953",
      "galleryImages": [
        "https://framerusercontent.com/images/og-social-preview-2.webp?width=5930&height=3953"
      ]
    },
    {
      "slug": "slyrs-experience-centre",
      "title": "Slyrs Experience Centre",
      "category": "Brand Architecture",
      "year": "2024",
      "client": "Slyrs Distillery",
      "location": "Schliersee, Germany",
      "description": "The Slyrs Experience Centre at Lake Schliersee offers an immersive journey through the world of whisky with interactive installations and sensory experiences inspired by the surrounding landscape.",
      "heroImage": "https://framerusercontent.com/images/og-social-preview-2.jpeg?width=5976&height=3976",
      "galleryImages": [
        "https://framerusercontent.com/images/project-slyrs-experience-centre.png",
        "https://framerusercontent.com/images/project-slyrs-experience-centre.jpg"
      ]
    },
    {
      "slug": "381-event-space",
      "title": "381 Event Space",
      "category": "Event Venue & Stage Design",
      "year": "2023",
      "client": "381 Space",
      "location": "Braunschweig, Germany",
      "description": "381 Event Space in Braunschweig combines flexible architectural zoning, modular stage configurations, and atmospheric lighting for next-generation brand events and creative summits.",
      "heroImage": "https://framerusercontent.com/images/og-social-banner.jpg?width=2000&height=1333",
      "galleryImages": []
    },
    {
      "slug": "cycla",
      "title": "Cycla",
      "category": "Product & Spatial Design",
      "year": "2022",
      "client": "Cycla Mobility",
      "location": "Munich, Germany",
      "description": "Cycla explores sustainable micro-mobility and modular spatial storage, integrating industrial product design with minimal architectural showroom installations.",
      "heroImage": "https://framerusercontent.com/images/og-social-banner.jpg?width=2000&height=1333",
      "galleryImages": []
    },
    {
      "slug": "ding-dong-ping-pong",
      "title": "Ding Dong Ping Pong",
      "category": "Interactive Installation",
      "year": "2023",
      "client": "Ding Dong Collective",
      "location": "Berlin, Germany",
      "description": "Ding Dong Ping Pong is an interactive social installation in Berlin that combines recreational sport, vibrant industrial materials, and dynamic spatial design.",
      "heroImage": "https://framerusercontent.com/images/og-social-banner.jpg?width=2000&height=1333",
      "galleryImages": []
    },
    {
      "slug": "kantine-komtur",
      "title": "Kantine Komtur",
      "category": "Interior Design",
      "year": "2022",
      "client": "Kantine Komtur",
      "location": "Berlin, Germany",
      "description": "Kantine Komtur blends historical architectural heritage with contemporary hospitality design, creating an inviting culinary destination in Berlin.",
      "heroImage": "https://framerusercontent.com/images/og-social-banner.jpg?width=2000&height=1333",
      "galleryImages": []
    }
  ],
  "author": {
    "name": "Meshack Rono",
    "shortName": "Meshack",
    "title": "Software Engineer & Full-Stack Developer",
    "tagline": "Building scalable web applications, cloud APIs, and interactive UI/UX experiences",
    "email": "meshackrono05@gmail.com",
    "location": "Nairobi, Kenya"
  },
  "socials": {
    "linkedin": "https://www.linkedin.com/in/meshackrono10/",
    "github": "https://github.com/meshackrono10",
    "instagram": "https://www.instagram.com/m.esh_ac/"
  },
  "site": {
    "title": "Meshack Rono — Portfolio",
    "domain": "https://meshack.dev",
    "description": "Software Engineer & Full-Stack Developer based in Nairobi, Kenya. Building scalable web applications, cloud APIs, and interactive UI/UX experiences."
  },
  "about": {
    "headline": "MESHACK is a Software Engineer & Full-Stack Developer based in Nairobi, Kenya.",
    "subheadline": "Not just code. Solutions. Systems where engineering meets people.",
    "bioParagraphs": [
      "I work where clean software engineering meets thoughtful product design. Where complex architecture becomes an effortless user experience.",
      "Based in Nairobi, Kenya, I specialize in architecting and building end-to-end web applications, distributed cloud APIs, and intuitive user interfaces that scale seamlessly.",
      "From full-stack SaaS platforms and real-time data pipelines to scalable APIs, cloud-native backends, and responsive frontend design systems."
    ],
    "profileImage": "https://framerusercontent.com/images/og-social-preview.webp?width=1331&height=2000"
  },
  "services": [
    {
      "slug": "brand-architecture",
      "title": "Full-Stack Web Apps",
      "description": "Production-ready, highly responsive web applications built with modern frontend frameworks and robust backend APIs."
    },
    {
      "slug": "brand-product-activation",
      "title": "Frontend & Interactive UI",
      "description": "Dynamic web interfaces with smooth animations, accessible typography, and intuitive user experiences."
    },
    {
      "slug": "event-brand-experiences",
      "title": "Backend & API Architecture",
      "description": "High-throughput REST and GraphQL APIs, asynchronous event processing, and microservice architectures."
    },
    {
      "slug": "interior-and-spatial-design",
      "title": "Cloud & DevOps Systems",
      "description": "Scalable cloud infrastructure, automated CI/CD deployment pipelines, containerization, and monitoring."
    },
    {
      "slug": "retail-hospitality",
      "title": "UI/UX & Design Systems",
      "description": "Design tokens, reusable component libraries, and unified brand design systems."
    },
    {
      "slug": "strategy-consulting",
      "title": "AI & Product Engineering",
      "description": "Integrating LLM workflows, intelligent assistants, and data-driven product features."
    },
    {
      "slug": "workplace-new-work",
      "title": "Technical Architecture",